<?xml version="1.0" encoding="UTF-8"?>
<!DOCTYPE pkgmetadata SYSTEM "https://www.gentoo.org/dtd/metadata.dtd">
<pkgmetadata>
	<maintainer type="person">
		<name>Florian Schmaus</name>
		<email>flow@gentoo.org</email>
	</maintainer>
	<stabilize-allarches/>
	<upstream>
		<remote-id type="github">jsonpath-ng/jsonpath-ng</remote-id>
		<remote-id type="pypi">jsonpath-ng</remote-id>
	</upstream>
</pkgmetadata>
