<?xml version="1.0" encoding="UTF-8"?>
<!DOCTYPE pkgmetadata SYSTEM "http://www.gentoo.org/dtd/metadata.dtd">
<pkgmetadata>
	<maintainer type="person">
		<email>chewi@gentoo.org</email>
		<name>James Le Cuirot</name>
	</maintainer>
	<upstream>
		<remote-id type="github">FrodeSolheim/fs-uae</remote-id>
	</upstream>
	<use>
		<flag name="fmv">Enable support for CD32 FMV (full motion video)</flag>
		<flag name="glew">Enable support for The OpenGL Extension Wrangler Library (<pkg>media-libs/glew</pkg>)</flag>
	</use>
</pkgmetadata>
