<?xml version="1.0" encoding="UTF-8"?>
<!DOCTYPE pkgmetadata SYSTEM "http://www.gentoo.org/dtd/metadata.dtd">
<pkgmetadata>
	<maintainer type="person">
		<email>conikost@gentoo.org</email>
		<name>Conrad Kostecki</name>
	</maintainer>
	<maintainer type="project">
		<email>java@gentoo.org</email>
		<name>Java</name>
	</maintainer>
	<longdescription>
		Mod_JK is a connector used to connect to the Tomcat Servlet Engine,
		used with web servers such as Apache and IIS using the AJP protocol.
	</longdescription>
	<upstream>
		<remote-id type="github">apache/tomcat-connectors</remote-id>
	</upstream>
</pkgmetadata>
