<?xml version="1.0" encoding="UTF-8"?>
<!DOCTYPE pkgmetadata SYSTEM "http://www.gentoo.org/dtd/metadata.dtd">
<pkgmetadata>
  <herd>python</herd>
  <maintainer>
    <email>prometheanfire@gentoo.org</email>
    <name>Matthew Thode</name>
  </maintainer>
  <longdescription lang="en">
    Setuptools revision control system plugin for Git
  </longdescription>
  <upstream>
    <remote-id type="pypi">setuptools-git</remote-id>
    <remote-id type="github">wichert/setuptools-git</remote-id>
  </upstream>
</pkgmetadata>
