<?xml version="1.0" encoding="UTF-8"?>
<!DOCTYPE pkgmetadata SYSTEM "http://www.gentoo.org/dtd/metadata.dtd">
<pkgmetadata>
	<maintainer type="person">
		<email>fordfrog@gentoo.org</email>
		<name>Miroslav Å ulc</name>
	</maintainer>
	<maintainer type="person" proxied="yes">
		<email>alexander@tsoy.me</email>
		<name>Alexander Tsoy</name>
	</maintainer>
	<maintainer type="project" proxied="proxy">
		<email>proxy-maint@gentoo.org</email>
		<name>Proxy Maintainers</name>
	</maintainer>
	<use>
		<flag name="lv2">Build lv2 plugins</flag>
		<flag name="nsm">Build NSM (Non Session Manager) support</flag>
		<flag name="standalone">Build standalone application</flag>
	</use>
</pkgmetadata>
