<?xml version="1.0" encoding="UTF-8"?>
<!DOCTYPE pkgmetadata SYSTEM "http://www.gentoo.org/dtd/metadata.dtd">
<pkgmetadata>
	<maintainer type="person">
		<email>hurikhan77+bgo@gmail.com</email>
		<name>Kai Krakow</name>
	</maintainer>
	<maintainer type="project">
		<email>proxy-maint@gentoo.org</email>
		<name>Proxy Maintainers</name>
	</maintainer>
	<upstream>
		<bugs-to>https://github.com/FeralInteractive/gamemode/issues</bugs-to>
		<remote-id type="github">FeralInteractive/gamemode</remote-id>
	</upstream>
</pkgmetadata>
