<?xml version="1.0" encoding="UTF-8"?>
<!DOCTYPE pkgmetadata SYSTEM "http://www.gentoo.org/dtd/metadata.dtd">
<pkgmetadata>
	<maintainer type="project">
		<email>python@gentoo.org</email>
		<name>Python</name>
	</maintainer>
	<stabilize-allarches/>
	<upstream>
		<remote-id type="pypi">snowballstemmer</remote-id>
		<remote-id type="github">snowballstem/snowball</remote-id>
	</upstream>
</pkgmetadata>
