<?xml version="1.0" encoding="UTF-8"?>
<!DOCTYPE pkgmetadata SYSTEM "https://www.gentoo.org/dtd/metadata.dtd">
<pkgmetadata>
  <maintainer type="project">
    <email>gnome@gentoo.org</email>
    <name>Gentoo GNOME Desktop</name>
  </maintainer>
  <upstream>
    <changelog>https://gitlab.gnome.org/GNOME/gcr/-/blob/main/NEWS</changelog>
    <doc>https://gnome.pages.gitlab.gnome.org/gcr/gcr-4/</doc>
    <remote-id type="gnome-gitlab">GNOME/gcr</remote-id>
  </upstream>
</pkgmetadata>
