<?xml version="1.0" encoding="UTF-8"?>
<!DOCTYPE pkgmetadata SYSTEM "http://www.gentoo.org/dtd/metadata.dtd">
<pkgmetadata>
  <maintainer type="person">
    <email>dev-zero@gentoo.org</email>
    <name>Tiziano MÃ¼ller</name>
  </maintainer>
  <maintainer type="project">
    <email>perl@gentoo.org</email>
    <name>Gentoo Perl Project</name>
  </maintainer>
  <upstream>
    <remote-id type="cpan">Set-Crontab</remote-id>
    <remote-id type="cpan-module">Set::Crontab</remote-id>
  </upstream>
</pkgmetadata>
