<?xml version="1.0" encoding="UTF-8"?>
<!DOCTYPE pkgmetadata SYSTEM "http://www.gentoo.org/dtd/metadata.dtd">
<pkgmetadata>
	<maintainer type="person">
		<email>maksbotan@gentoo.org</email>
		<name>Maxim Koltsov</name>
	</maintainer>
	<maintainer type="project">
		<email>python@gentoo.org</email>
		<name>Python</name>
	</maintainer>
	<longdescription>
	This package provides Python bindings for Network Security Services (NSS)
	and the Netscape Portable Runtime (NSPR)
</longdescription>
</pkgmetadata>
