<?xml version="1.0" encoding="UTF-8"?>
<!DOCTYPE pkgmetadata SYSTEM "https://www.gentoo.org/dtd/metadata.dtd">
<pkgmetadata>
  <maintainer type="person">
    <email>mjo@gentoo.org</email>
  </maintainer>

  <maintainer type="person" proxied="yes">
    <email>frp.bissey@gmail.com</email>
    <name>Fran√ßois Bissey</name>
  </maintainer>
  <maintainer type="project" proxied="proxy">
    <email>proxy-maint@gentoo.org</email>
    <name>Proxy Maintainers</name>
  </maintainer>

  <use>
    <flag name="executable">Build the primesieve CLI executable</flag>
  </use>

  <upstream>
    <remote-id type="github">kimwalisch/primesieve</remote-id>
  </upstream>
</pkgmetadata>
