<?xml version="1.0" encoding="UTF-8"?>
<!DOCTYPE pkgmetadata SYSTEM "http://www.gentoo.org/dtd/metadata.dtd">
<pkgmetadata>
  <herd>python</herd>
  <maintainer>
    <email>grozin@gentoo.org</email>
    <name>Andrey Grozin</name>
  </maintainer>
  <longdescription>
  pygtk-based python shell with autocompletion
</longdescription>
  <upstream>
    <remote-id type="pypi">dreampie</remote-id>
  </upstream>
</pkgmetadata>
